name	type	category	source	requirements	description	url
Dealmaker	Equipment	Equipment	Adventurer's Armory pg. 30		You have the air of a person with money, allowing you to buy and sell valuables that otherwise are too rich for the local community. Once per week, when looking for an item with a price greater than the local community’s base value (see page 461 of the Pathfinder RPG Core Rulebook), make a DC 10 Diplomacy check; add 10 to the DC for each community size category between the current community and the community size with a base value sufficient for that item. Success means (with GM approval) you’re able to sell or purchase that item as if the local community were of sufficient size. Each additional attempt (successful or otherwise) in that community increases the DC by an additional +10.<br>Example: If you’re trying to find a +1 cloak of resistance (1,000 gp), you’d normally need to be in a small town (base value 1,000 gp) or larger to be able to find that item with little trouble. If you’re currently in a hamlet, that’s two community sizes away from a small town, so the Diplomacy DC is 30. If you went to a village and asked there, the DC would only be 20 because it’s only one community size away from a small town.	https://aonprd.com/TraitDisplay.aspx?ItemName=Dealmaker
Extremely Fashionable	Equipment	Equipment	Adventurer's Armory pg. 30		You really know how to make a good impression when you’re dressed well. Whenever you are wearing clothing and/or jewelry worth at least 150 gp (and not otherwise covered in gore, sewage, or other things that mar your overall look), you gain a +1 trait bonus on Bluff, Diplomacy, and Intimidate checks. One of these skills (your choice) is a class skill for you.	https://aonprd.com/TraitDisplay.aspx?ItemName=Extremely%20Fashionable
Heirloom Weapon	Equipment	Equipment	Adventurer's Armory pg. 30		You carry a non-masterwork simple or martial weapon that has been passed down from generation to generation in your family (pay the standard gp cost for the weapon). When you select this trait, choose one of the following benefits: proficiency with that specific weapon, a +1 trait bonus on attacks of opportunity with that specific weapon, or a +2 trait bonus on one kind of combat maneuver when using that specific weapon.	https://aonprd.com/TraitDisplay.aspx?ItemName=Heirloom%20Weapon
Improvisational Equipment	Equipment	Equipment	Adventurer's Armory pg. 30		You have an uncanny knack for turning equipment to new and unexpected uses. When using an item for anything other than its intended purpose—such as using a crowbar as a grappling hook or an old shirt to bandage a deadly wound—reduce the improvisation penalty by 2. This does not apply to improvised weapon penalties. Your GM may rule that some things are just not suitable for use in certain ways; for example, gluing a dead orc’s face to your own face won’t help you disguise yourself as an orc.	https://aonprd.com/TraitDisplay.aspx?ItemName=Improvisational%20Equipment
Iron Liver	Equipment	Equipment	Adventurer's Armory pg. 30		Due to a lucky constitution or frequent exposure, your body is resistant to poison, including alcohol and drugs. You gain a +2 trait bonus on Fortitude saves against poison and drugs, and a +4 trait bonus on Fortitude saves to avoid the effects of alcohol.	https://aonprd.com/TraitDisplay.aspx?ItemName=Iron%20Liver
Power of Suggestion	Equipment	Equipment	Adventurer's Armory pg. 30		People trust your words over their own eyes. You may make a Bluff check to make observers believe that an object in your possession is actually a different object entirely. The DC for the check is 20 for items of a similar size, shape, and color (such as a glaive and a quarterstaff). Items of a different shape, size, or color raise the DC by 5 for each dissimilar aspect, or more if the dissimilarity is extreme. This deception lasts 1 minute; if the item is still in view, the observers may recognize their error unless you make another bluff check.	https://aonprd.com/TraitDisplay.aspx?ItemName=Power%20of%20Suggestion
Prehensile Whip	Equipment	Equipment	Adventurer's Armory pg. 31		In your hand a whip has a life of its own, wrapping around pillars and beams with ease. You can use a whip as if it were a rope with a grappling hook at the end. Attaching your whip is a standard action, but detaching it is a full-round action.	https://aonprd.com/TraitDisplay.aspx?ItemName=Prehensile%20Whip
Quick Learner	Equipment	Equipment	Adventurer's Armory pg. 31		You’re skilled at learning the feel of a particular weapon after a few swings in combat. After your first attack with a weapon in which you are not proficient, the non-proficiency penalty decreases by 2 (to a –2 penalty). This effect lasts only while you have the weapon in hand; you must “relearn” the weapon each time you pick it up.	https://aonprd.com/TraitDisplay.aspx?ItemName=Quick%20Learner
Rough and Ready	Equipment	Equipment	Adventurer's Armory pg. 31		Your intense familiarity with the tools of your trade allows you to use them in combat as if they were actual weapons and makes them more effective for that purpose than they would normally be. When you use a tool of your trade (requiring at least 1 rank in the appropriate Craft or Profession skill) as a weapon, you do not take the improvised weapon penalty and instead receive a +1 trait bonus on your attack. This trait is commonly used with shovels, picks, blacksmith hammers, and other sturdy tools—lutes and brooms make terribly fragile weapons.	https://aonprd.com/TraitDisplay.aspx?ItemName=Rough%20and%20Ready
Stage Magic	Equipment	Equipment	Adventurer's Armory pg. 31		You have put in many hours practicing with flashy alchemical items that enhance your Perform skill. When you use an attention-getting alchemical item such as a flask of alchemist’s fire, smokestick, thunderstone, or another appropriate alchemical item (GM’s discretion) as part of a performance, you gain a +2 trait bonus on your Perform check for the duration of that performance. The item is expended without its normal effects and only serves to make your performance more impressive; for example, you could pretend to ignite yourself with alchemist’s fire as part of a Perform (comedy) check or make a dramatic appearance with a smokestick as part of a Perform (act) check, but you would not actually take fire damage or gain concealment from smoke.	https://aonprd.com/TraitDisplay.aspx?ItemName=Stage%20Magic
Stealthy Escape	Equipment	Equipment	Adventurer's Armory pg. 31		You are adept at escaping from confinement in an unobtrusive manner. When trying to escape manacles, rope, or other similar restraints (but not grapples or similar attacks), you may make a Sleight of Hand check instead of your Escape Artist modifier. If you free yourself, you gain a +2 trait bonus on Bluff checks to pretend that you are still bound.	https://aonprd.com/TraitDisplay.aspx?ItemName=Stealthy%20Escape
Thrown-Together Fashion	Equipment	Equipment	Adventurer's Armory pg. 31		You can modify old clothing to make it effective in new circumstances. With a basic sewing kit or disguise kit, you can make a Disguise check to change one outfit into another outfit (see page 159 of the Pathfinder RPG Core Rulebook, or page 13 of this book). The DC of this check is equal to 10 + the gp difference between costs of the outfits. The alteration takes 10 minutes per 1-gp difference in the cost of the outfits.	https://aonprd.com/TraitDisplay.aspx?ItemName=Thrown-Together%20Fashion
Well-Provisioned Adventurer	Equipment	Equipment	Plane-Hopper's Handbook pg. 10		You always knew that one day you would leave your humble beginnings behind and become an adventurer, so you scrimped and saved, buying the necessary equipment one piece at a time until you had everything you needed. Select one of the equipment packages below. If you select this trait during character creation, you do not receive any starting gold.<br>Arcane Adept Package<br>Source Adventurer's Armory 2 pg. 4<br>The arcane adept has collected useful magical gear to ensure her success on her adventures, and she prides herself on having just the right tool for the job. This equipment package is appropriate for an arcanist, sorcerer, witch, or wizard. Some bards and summoners might also find it attractive. This equipment package can also work for a magus if the 1st-level scrolls and wand are replaced with a masterwork melee weapon.<br>Weapons: Light crossbow with 10 bolts, quarterstaff.<br>Combat Gear: Acid (2), scrolls of comprehend languages (2), scroll of detect secret doors, scroll of glitterdust, scrolls of identify (2), scroll of mount, scroll of rope trick, thunderstone, wand of mage armor (16 charges).<br>Other Gear: Backpack, bedroll, belt pouch, candles (5), chalk (5 pieces), flint and steel, ink, inkpen, ioun torch, journal, magnifying glass, mess kit, scroll box, silk rope (50 ft.), spell component pouch, trail rations (5 days), waterskin, 3 gp.<br>Total Weight: 45 lbs. (28-3/4 lbs. for a Small character).Blessed Warden Package<br>Source Plane-Hopper's Handbook pg. 10<br>A blessed warden is prepared to protect herself against the horrors of evil-aligned planes. This equipment package is suitable for clerics, druids, inquisitors, oracles, and paladins. The specific gear is appropriate for those visiting the chaotic evil Abyss but can be adjusted to suit other evilaligned planes, such as swapping the scrolls of protection from chaos for scrolls of protection from law for a package designed for travel to Hell.<br>Armor: Masterwork chain shirt.<br>Weapons: Cold iron shortspear, light crossbow with 20 crossbow bolts.<br>Combat Gear: Holy water (3), scrolls of cure light wounds (2), scrolls of protection from chaos (2), scrolls of protection from evil (2), scroll of remove curse.<br>Other Gear: Backpack, bedroll, candles (5), chalk (5 pieces), crowbar, ioun torch, mess kit, shovel, silk rope (50 ft.), spell component pouch, trail rations (5 days), waterskin, wooden holy symbol, 13 gp.<br>Total Weight: 74 lbs. (44-1/2 lbs. for a Small character).Corporeal Warrior Package<br>Source Plane-Hopper's Handbook pg. 10<br>Normal equipment is ill suited to fighting intangible foes, and a warrior bound for the Ethereal Plane must be prepared for incorporeal threats lurking in the ever-present mists. This equipment package is suitable for fighters and paladins. If the PC can cast spells, add a spell component pouch.<br>Armor: Masterwork breastplate.<br>Weapons: Heavy crossbow with 10 bolts, heavy mace, masterwork longsword.<br>Combat Gear: Alchemist’s fire, potion of mage armor, potion of shield, oil of magic weapon.<br>Other Gear: Backpack, bedroll, candles (5), chalk (5 pieces), crowbar, ioun torch, mess kit, shovel, silk rope (50 ft.), trail rations (5 days), waterskin, 10 gp.<br>Total Weight: 87 lbs. (48-1/2 lbs. for a Small character).Daring Bravo Package<br>Source Adventurer's Armory 2 pg. 4<br>The daring bravo is equally adept in social situations and combat, with the right equipment to move fluidly from one to the other. Such adventurers are known as much for their flair and panache as their martial prowess, and the daring bravo’s equipment is often ornately ornamented or personalized. This equipment package is good for a bard, fighter, rogue, swashbuckler, or vigilante. Certain cavaliers, investigators, skalds, or even paladins may also find it appealing. If the PC can cast spells, add a spell component pouch.<br>Armor: Masterwork chain shirt.<br>Weapons: Light crossbow with 10 bolts, masterwork rapier, sap, alchemical silver dagger.<br>Combat Gear: Acid (2), alchemist’s kindness, potions of cure light wounds (2), sunrods (3).<br>Other Gear: Backpack, bedroll, belt pouch, bottle of fine wine, chalk (5 pieces), courtier’s outfit with 50 gp in jewelry, flask, flint and steel, grooming kit, masterwork musical instrument, mess kit, mirror, perfume or cologne, sack, signet ring, silk rope (50 ft.), trail rations (5 days), waterskin, whetstone, 5 gp.<br>Total Weight: 76-1/2 lbs. (40-1/2 lbs. for a Small character).Holy Warrior Package<br>Source Adventurer's Armory 2 pg. 4<br>The holy warrior is prepared to use her might and zeal to take the fight to the enemy, but she understands the importance of having the right equipment to overcome the resistances of her monstrous foes. This equipment package is well-suited to a cleric, inquisitor, paladin, warpriest, or even a fighter with a religious background. It’s especially suited to characters who focus on supporting their party members and making them more effective in a fight. Even more than with other equipment packages, the GM should consider substituting the masterwork longsword in this package with a masterwork melee weapon appropriate to the PC’s faith. If the PC can cast spells, add a spell component pouch.<br>Armor: Heavy steel shield, masterwork breastplate.<br>Weapons: Cold iron morningstar, heavy crossbow with 10 bolts, masterwork longsword.<br>Combat Gear: Alchemist’s fire (3), holy water (4), oil of bless weapon, potions of cure light wounds (2), potion of protection from evil, sunrods (3).<br>Other Gear: Backpack, bedroll, belt pouch, candles (5), chalk (5 pieces), crowbar, flint and steel, holy symbol (silver), mess kit, sack, silk rope (50 ft.), trail rations (5 days), waterskin, 7 gp.<br>Total Weight: 102 lbs. (57-1/4 lbs. for a Small character).Lore Seeker Package<br>Source Adventurer's Armory 2 pg. 5<br>The lore seeker has the equipment necessary to delve into ancient ruins searching for lost knowledge. As this equipment package contains little by way of armor or weapons, it is most appropriate for alchemists, bards, monks, sorcerers, and wizards. If the PC can cast spells, add a spell component pouch and a holy symbol (if required).<br>Weapons: Light crossbow with 10 bolts, quarterstaff, silver dagger.<br>Combat Gear: Alchemist’s fire (3), antitoxin, oil of erase, potions of cure light wounds (2), potion of protection from evil, tanglefoot bag, thunderstone.<br>Other Gear: Backpack, bedroll, belt pouch, candles (5), chalk (5 pieces), compass, crowbar, everburning torch, flint and steel, grappling hook, ink, inkpens (2), journals (2), magnifying glass, mapmaker’s kit, mess kit, sack, signal whistle, silk rope (50 ft.), trail rations (5 days), traveler’s any-tool, waterskin, 8 gp.<br>Total Weight: 44 lbs. (27-3/4 lbs. for a Small character).Mystic Guide Package<br>Source Adventurer's Armory 2 pg. 5<br>This equipment package is designed to provide the most aid to divine casters, such as clerics, druids, oracles, and inquisitors, who prefer to help their companions from behind the front lines of a fight.<br>Armor: Leather armor, light wooden shield.<br>Weapons: Shortspear, sling with 10 bullets.<br>Combat Gear: Antitoxin, bead of blessing (as a lesser strand of prayer beads without the bead of healing), holy water (2), scrolls of cure light wounds (2), scroll of endure elements.<br>Other Gear: Backpack, bedroll, belt pouch, candles (5), chalk (5 pieces), flint and steel, healer’s kit, holy symbol (silver), ioun torch, mess kit, mirror, sack, shovel, silk rope (50 ft.), smelling salts, soap, spell component pouch, trail rations (5 days), waterskin, 4 sp.<br>Total Weight: 67 lbs. (39-1/4 lbs. for a Small character).Planar Traveler Package<br>Source Plane-Hopper's Handbook pg. 10<br>This package equipment prepares planar travelers for the challenges of a variety of planar destinations. This package works particularly well for lightly armored combatants, such as bards and rogues. If the PC purchasing it can cast spells, add a spell component pouch as well.<br>Armor: Masterwork studded leather, light wooden shield.<br>Weapons: Composite longbow with 20 arrows, masterwork morningstar.<br>Combat Gear: Alchemist’s fire (3), potion of air bubble, potions of cure light wounds (2), potions of endure elements (2).<br>Other Gear: Backpack, bedroll, candles (5), chalk (5 pieces), crowbar, ioun torch, mess kit, shovel, silk rope (50 ft.), trail rations (5 days), waterskin, 11 gp.<br>Total Weight: 75 lbs. (42-1/2 lbs. for a Small character).Questing Knight Package<br>Source Adventurer's Armory 2 pg. 5<br>If not descended from nobility, the questing knight certainly looks like he fits the part. This equipment package is useful for cavaliers, fighters, and paladins. If the PC can cast spells, add a spell component pouch and a holy symbol (if required). If the PC gains a mount from a class feature, remove the horse from the list below and replace the lance with a masterwork lance.<br>Armor: Half-plate, heavy wooden shield.<br>Weapons: Javelins (4), lance, longsword.<br>Combat Gear: Sunrods (2).<br>Other Gear: Backpack, banner, bedroll, belt pouch, flask, flint and steel, mess kit, pole (10 ft.), sack, shovel, signet ring, silk rope (50 ft.), trail rations (5 days), waterskin, whetstone, 8 gp.<br>Mount: Heavy horse (combat trained) with bit and bridle, military saddle, and saddlebags.<br>Total Weight: 127-1/2 lbs. (73-3/4 lbs. for a Small character).Shadowy Stalker Package<br>Source Adventurer's Armory 2 pg. 5<br>Skulking through a city or a dungeon, the shadowy stalker is equipped to strike quickly and fade away. This equipment package is appropriate for stealthy characters such as rangers, rogues, and slayers, and for some bards and investigators. If the PC can cast spells, add a spell component pouch.<br>Armor: Masterwork leather armor.<br>Weapons: Daggers (3), masterwork sickle, sap.<br>Combat Gear: Alchemist’s fire (3), smokesticks (2), sunrods (2).<br>Other Gear: Bedroll, belt pouch, caltrops, candles (5), chalk (5 pieces), disguise kit, flint and steel, glass cutter, masterwork backpack, masterwork thieves’ tools, mess kit, sack, silk rope (50 ft.), sleeves of many garments, trail rations (5 days), waterskin, 1 gp.<br>Total Weight: 63 lbs. (33-1/4 lbs. for a Small character).Wilderness Wanderer Package<br>Source Adventurer's Armory 2 pg. 5<br>This equipment package is appropriate for any lightly-armored combatant in the wild, such as a barbarian, hunter, or ranger. If the PC can cast spells, add a spell component pouch and holly and mistletoe. The GM might consider altering which weapon is masterwork, based on the PC’s specialization. For example, an archery-focused ranger might prefer a masterwork composite longbow over a masterwork greataxe.<br>Armor: Light wooden quickdraw shield, masterwork studded leather armor.<br>Weapons: Cold iron flail, composite longbow with 20 arrows, masterwork greataxe, short sword.<br>Combat Gear: Alchemist’s fire (2), antitoxin, potion of keen senses, sunrods (3).<br>Other Gear: Backpack, bedroll, belt pouch, chalk (5 pieces), climber’s kit, cold-weather outfit, fishhook, flint and steel, mess kit, pole (10 ft.), shovel, signal whistle, silk rope (50 ft.), trail rations (5 days), waterskin, 2 sp.<br>Total Weight: 108-1/2 lbs. (63-1/4 lbs. for a Small character).	https://aonprd.com/TraitDisplay.aspx?ItemName=Well-Provisioned%20Adventurer
Artist of Battle in All Forms	Exemplar	Exemplar	Chronicle of Legends pg. 2		Exemplar Type Combat Exemplar<br>You employ complex combat tactics with ease. Choose a type of combat maneuver. You gain a +1 trait bonus on combat maneuver checks to perform that maneuver, and you do not provoke an attack of opportunity from the target unless that creature has the appropriate Improved feat, such as Improved Grapple if you attempt a combat maneuver check to grapple. For every two other combat traits you have, choose an additional type of combat maneuver to gain these benefits.	https://aonprd.com/TraitDisplay.aspx?ItemName=Artist%20of%20Battle%20in%20All%20Forms
Charming Smile, Cunning Soul	Exemplar	Exemplar	Chronicle of Legends pg. 3		Exemplar Type Social Exemplar<br>You know how to guilefully weave words, sway hearts and minds, verbally destroy rivals, and pierce cunning lies. You gain a +1 trait bonus on Bluff, Diplomacy, Intimidate, and Sense Motive checks. This bonus increases by 1 for every two other social traits you have.	https://aonprd.com/TraitDisplay.aspx?ItemName=Charming%20Smile,%20Cunning%20Soul
Curator of Mystic Secrets	Exemplar	Exemplar	Chronicle of Legends pg. 3		Exemplar Type Magic Exemplar<br>Your broad collection of lore grants unparalleled understanding of magic’s underlying principles. Twice per day when spontaneously casting a spell altered by metamagic, you can do so without increasing the spell’s casting time. For each other magic trait you have, you can use this trait’s benefit an additional time each day.	https://aonprd.com/TraitDisplay.aspx?ItemName=Curator%20of%20Mystic%20Secrets
Faith Unshakable and Unassailable	Exemplar	Exemplar	Chronicle of Legends pg. 3		Exemplar Type Faith Exemplar<br>Your dedication to your ideals is stronger than steel. You gain a +2 trait bonus on Will saves against charm, compulsion, and fear effects. For every two other faith traits you have, this bonus increases by 1.	https://aonprd.com/TraitDisplay.aspx?ItemName=Faith%20Unshakable%20and%20Unassailable
Traveler of a Hundred Lands	Exemplar	Exemplar	Chronicle of Legends pg. 3		Exemplar Type Regional Exemplar<br>You have learned the ways of many lands. Choose any two skills; each of those skills becomes a class skill for you. For every other regional trait you have, select an additional skill to treat as a class skill.	https://aonprd.com/TraitDisplay.aspx?ItemName=Traveler%20of%20a%20Hundred%20Lands
A Sure Thing	Faction	Faction	PFS Guide to Organized Play 6.0 pg. 16		Once per day, you gain a +2 bonus on a single attack roll against an evil-aligned creature. If the creature is not evil-aligned, this ability is wasted with no benefit.	https://aonprd.com/TraitDisplay.aspx?ItemName=A%20Sure%20Thing
Ancient Historian	Faction	Faction	PFS Guide to Organized Play 6.0 pg. 16		You are well acquainted with the lore of fallen empires. Choose either Knowledge (history) or Linguistics. That skill becomes a class skill for you, and you begin play able to speak and read one of the following languages: Ancient Osiriani, Azlanti, Cyclops, Jistkan, Tekritanin, or Thassilonian.	https://aonprd.com/TraitDisplay.aspx?ItemName=Ancient%20Historian
Arcane Archivist	Faction	Faction	PFS Guide to Organized Play 6.0 pg. 14		You have spent years handling magic items and know how to test their functions while avoiding catastrophic results. You gain a +1 trait bonus on Use Magic Device checks, and this skill becomes a class skill for you.	https://aonprd.com/TraitDisplay.aspx?ItemName=Arcane%20Archivist
Attuned to the Ancestors	Faction	Faction	PFS Guide to Organized Play 6.0 pg. 16		You were raised to believe that undead are nothing to fear—they are simply the unliving remnants of your honored ancestors. Once per day, you can surround yourself with an aura of unlife. Unintelligent undead ignore you unless you take action against them, per hide from undead. The protection lasts 1 round for every two character levels you possess (with a minimum of 1 round). If you take any offensive action against any undead, this effect immediately ends. This is a supernatural ability.	https://aonprd.com/TraitDisplay.aspx?ItemName=Attuned%20to%20the%20Ancestors
Beneficent Touch	Faction	Faction	PFS Guide to Organized Play 6.0 pg. 16		Once per day, when you cast a spell or use a class ability that heals hit point damage, reroll any 1s that appear on the dice and take the new roll (even if it is another 1).	https://aonprd.com/TraitDisplay.aspx?ItemName=Beneficent%20Touch
Captain's Blade	Faction	Faction	PFS Guide to Organized Play 6.0 pg. 15		You were born on board a ship and learned to fight beside the sailing men and women of the Andoran fleet. While on board any vessel afloat on water, you gain a +1 trait bonus on Acrobatics and Climb checks. One of these skills (your choice) becomes a class skill for you.	https://aonprd.com/TraitDisplay.aspx?ItemName=Captain's%20Blade
Comparative Religion	Faction	Faction	PFS Guide to Organized Play 6.0 pg. 17		Your allies within the Silver Crusade have taught you a lot about Golarion’s deities and their followers. You gain a +1 trait bonus on Knowledge (religion) checks, and Knowledge (religion) becomes a class skill for you.	https://aonprd.com/TraitDisplay.aspx?ItemName=Comparative%20Religion
Devil's Mark	Faction	Faction	PFS Guide to Organized Play 6.0 pg. 14		You bear the stain of a higher fiend upon you, and any evil creature who sees it may think twice before crossing you. You gain a +2 trait bonus on all Bluff, Diplomacy, Intimidate, and Sense Motive checks when dealing with outsiders of the evil subtype.	https://aonprd.com/TraitDisplay.aspx?ItemName=Devil's%20Mark
Expert Duelist	Faction	Faction	PFS Guide to Organized Play 6.0 pg. 17		In your youth, you spent countless hours perfecting the art of the duel, focusing your efforts on defeating a single foe. You gain a +1 trait bonus to your Armor Class so long as you are adjacent to a single foe. This trait bonus is not applied to your Armor Class for touch attacks or when you are denied your Dexterity bonus.	https://aonprd.com/TraitDisplay.aspx?ItemName=Expert%20Duelist
Fashionable	Faction	Faction	PFS Guide to Organized Play 6.0 pg. 17		You spent your formative years as a young blade in Oppara and learned the ins and outs of using fashion to improve your relations with others. So long as you are wearing clothing and jewelry worth more than 80 gp, you gain a +1 trait bonus on Bluff, Diplomacy, and Sense Motive checks. One of these skills (your choice) becomes a class skill for you.	https://aonprd.com/TraitDisplay.aspx?ItemName=Fashionable
