name	type	category	source	requirements	description	url
Animal Whisperer	Campaign	Campaign	Ironfang Invasion Player's Guide pg. 7		You’ve spent more of your life around animals than people, and find them easier to understand. You gain a +1 trait bonus on Handle Animal checks, and Handle Animal is always a class skill for you. Your trait bonus increases to +5 whenever you attempt to “push” a wild animal to perform a trick for you, so long as its attitude is indifferent or friendlier. You may target creatures of the animal type with charm or compulsion spells as if they were humanoids, but unless you have another ability to make yourself understood to animals, you must still succeed at a Handle Animal check to “push” your target in order to communicate specific requests.	https://aonprd.com/TraitDisplay.aspx?ItemName=Animal%20Whisperer
Apprentice Devilbinder	Campaign	Campaign	Hell's Vengeance Player's Guide pg. 12		It’s no secret that conjuring and binding devils is a popular pursuit in Cheliax, and you have served as an apprentice to a diabolist since a young age. Eventually, however, you decided you wanted more for yourself than a life of study and service, and when you felt you had learned all that you were likely to from your master, you struck out on your own. You know you can achieve the loftiest heights of power with the support of Hell behind you, just as you are aware you can fall to the lowest depths if you’re incautious and lose that support. You are determined to use your skills and abilities to bind Hell and its minions to your will, and to make a name for yourself as one of Cheliax’s premier devilbinders.<br>When you cast a summon monster spell to summon a devil or fiendish creature, the duration of that spell increases by 1 round. In addition, you gain a +1 trait bonus on opposed Charisma checks against devils conjured with planar binding spells, and payments to devils you conjure with planar ally spells are reduced by 10%.	https://aonprd.com/TraitDisplay.aspx?ItemName=Apprentice%20Devilbinder
Artifact Hunter (GS)	Campaign	Campaign	Giantslayer Player's Guide pg. 6		You’ve always had an interest in magic, but you’re fascinated with those legendary magic items known as artifacts. You’ve spent years researching these mythical relics and committed the stories and legends about them to memory, making you something of an expert on the subject. You gain a +1 trait bonus on Spellcraft checks to identify the properties of magic items and a +1 trait bonus on Use Magic Device checks, and one of these skills (your choice) becomes a class skill for you. In addition, whenever you first encounter an artifact, there is a 50% chance (+1% per level) that you recognize the artifact and know its name, origin, and something of that artifact’s powers, abilities, or dangers. Exactly how much knowledge you possess is left to the GM’s discretion.	https://aonprd.com/TraitDisplay.aspx?ItemName=Artifact%20Hunter%20(GS)
Asmodean Acolyte	Campaign	Campaign	Hell's Vengeance Player's Guide pg. 12		You grew up in the church of Asmodeus, and have served as a faithful follower your entire life. You’ve studied the unholy texts, committed the rigid hierarchies of Hell to memory, and striven to eliminate emotion and mercy from your mind in emulation of the Prince of Darkness. You may have continued your career in the church, officially joining the priesthood and aspiring to advance to positions of higher authority and greater power, or you may have left the church, deciding the life of a priest was not for you. In either case, the education you received in the church has remained with you. You gain a +1 trait bonus on Diplomacy, Knowledge (planes), and Knowledge (religion) checks, and one of these skills (your choice) is a class skill for you. You also know the Infernal tongue (this does not count toward your number of languages).	https://aonprd.com/TraitDisplay.aspx?ItemName=Asmodean%20Acolyte
Athletic Champion	Campaign	Campaign	War for the Crown Player's Guide pg. 8		Your physique and skill brought you into the public eye, and a winning smile helps you stay there. Taldor honors its extraordinary athletes, celebrating them as cultural heroes. Whether you were a gladiator, a runner, a wrestler, or any other competitor, your most recent victory caused someone important to sit up and take notice. You may never have a political career in front of you, but for now your name is helping to bring a little extra money in, and maybe that’s good enough. Select two of the following skills: Climb, Diplomacy, Perception, and Swim. You gain a +1 trait bonus on checks with those skills, and they are always class skills for you. In addition, you are accustomed to maneuvering through crowds; you gain a +2 trait bonus on checks to navigate through a crowd or resist being moved against your will, including spells and bull rush, drag, and reposition combat maneuvers.	https://aonprd.com/TraitDisplay.aspx?ItemName=Athletic%20Champion
Athletic	Campaign	Campaign	Ruins of Azlant Player's Guide pg. 9		You have always had a knack for physical activity. You either grew up in a rural area and had an active childhood where you were always climbing trees, swimming in lakes and rivers, and clambering up rocky hillsides, or you competed in and excelled at contests or sports while growing up in a larger settlement. Due to this background, little can slow you down or inhibit your movements. When the Bountiful Venture Company interviewed you, they noticed your stature and physicality, and they chose you for the colonial expedition knowing that a strong back is always helpful in a growing colony.<br>You reduce your armor check penalty by a number equal to one-third your character level (minimum 1) for purposes of Acrobatics, Climb, and Swim checks, and you gain a +1 trait bonus to one of these three skills, chosen when you take this trait.	https://aonprd.com/TraitDisplay.aspx?ItemName=Athletic
Audrahni's Ally	Campaign	Campaign	Return of the Runelords Players Guide pg. 10		While every PC should be at least passingly familiar with the elven gravedigger Audrahni, you are one of the few in town she counts as a true friend. Work with the GM to determine what sort of common ground you and Audrahni share. Perhaps you worship a deity whose teachings parallel her vocation (such as Ashava or Pharasma). Maybe you’re a Forlorn elf and you sense a kindred spirit within her. With the GM’s permission you may have known her in Magnimar before meeting her once again upon arriving in Roderic’s Cove. Or perhaps you merely share a similar passion for arcana, dancing, history, magic, or religion. More details about Audrahni appear in the adventures, but she’s a mysterious woman who’s close lipped about her past—and so you’ll need to work with your GM to have a stronger relationship at the campaign’s outset.<br>Audrahni trusts you, and she’s shared one element of her past with you since befriending you. Choose one of the following questions. At the start of the campaign, the GM will give you a brief answer about Audrahni’s past. Once you know the answer, you should fashion a parallel event in your own PC’s history, creating a shared misery or memory with Audrahni. The fact that you’ve met someone else who had a similar event in their past has bolstered your own resolve, and has granted you a +1 trait bonus to the saving throw determined by the question you select.<br>“What happened to your parents?”: Grants a +1 trait bonus to Fortitude saving throws.<br>“Where did you grow up?”: Grants a +1 trait bonus to Reflex saving throws.<br>“What historical figure inspired you the most?”: Grants a +1 trait bonus to Will saving throws.<br>Once per adventure as a standard action, you may concentrate on the bond you and Audrahni share. The strong emotions brought on by these memories bolster your desire to forge ahead and remain alive, granting you the effects of one of the following spells at a caster level equal to your character level: calm emotions, cure moderate wounds, or lesser restoration.	https://aonprd.com/TraitDisplay.aspx?ItemName=Audrahni's%20Ally
Azlanti Scholar	Campaign	Region	Heroes from the Fringe pg. 2	Ironbound Archipelago, non-elf	Your interactions with the elves of the Mordant Spire have taught you much about Azlanti artifacts, and you now share the Mordant Spire elves’ fascination with these relics. You gain Azlanti as a bonus language, and you gain a +2 trait bonus on Appraise and Use Magic Device checks when attempting to identify or use authentic Azlanti artifacts.	https://aonprd.com/TraitDisplay.aspx?ItemName=Azlanti%20Scholar
Barroom Talespinner	Campaign	Campaign	Skull and Shackles Player's Guide pg. 5		You grew up listening to tales of adventure and piracy on the high seas and the sea chanteys of old salts in dockside dives. You learned all about what it’s like to be a pirate by talking with the sailors on shore leave, and learned how to tell a tale (or perform some other pirate entertainment) yourself. You gain a +1 trait bonus on Diplomacy checks and one category of Perform checks, and one of these skills is a class skill for you. In addition, once per week you can make a DC 15 Knowledge (local) or Intelligence check to see if you know a popular legendary pirate tale, the telling of which grants you a +1 trait bonus on checks made to influence NPCs on the Wormwood.<br>You went to a tavern called the Formidably Maid in Port Peril to earn a few coins with your tales of the sea. The patrons seemed pleased with your performance and bought you a few drinks. You had just remembered a tale of an unfortunate sailor who found himself press-ganged on a pirate ship after his drink was drugged when suddenly everything went black.	https://aonprd.com/TraitDisplay.aspx?ItemName=Barroom%20Talespinner
Bastard (KM)	Campaign	Campaign	Kingmaker Player's Guide pg. 10		(Human Only) One of your parents was a member of one of the great families of Brevoy, perhaps even of the line of Rogarvia itself. Yet you have no substantive proof of your nobility, and you’ve learned that claiming nobility without evidence makes you as good as a liar. While you might own a piece of jewelry, a scrap of once-rich fabric, or an aged confession of love, none of this directly supports your claim. Thus, you’ve lived your life in the shadow of nobility, knowing that you deserve the comforts and esteem of the elite, even though the contempt of fate brings you nothing but their scorn. Whether a recent attempt to prove your heritage has brought down the wrath of a noble family’s henchmen or you merely seek to prove the worth of the blood in your veins, you’ve joined an expedition into the Stolen Lands, hoping to make a name all your own. You take a –1 penalty on all Charisma-based skill checks made when dealing with members of Brevic nobility but gain a +1 trait bonus on Will saves as a result of your stubbornness and individuality. (The penalty aspect of this trait is removed if you ever manage to establish yourself as a true noble.)	https://aonprd.com/TraitDisplay.aspx?ItemName=Bastard%20(KM)
Besmara's Blessing	Campaign	Campaign	Skull and Shackles Player's Guide pg. 5		You were born aboard a ship at sea or down by the docks in a port city on an auspicious day. Old salts and sea dogs nod knowingly and say that Besmara the Pirate Queen, goddess of piracy, sea monsters, and strife, has marked you for a greater destiny. You don’t know anything about that, but you’ve always felt more at home on the sea than on land, and your keen eyes can easily pick out a sail on the distant horizon. You gain a +1 trait bonus on Perception and Profession (sailor) checks. In addition, once per week you can reroll a Profession (sailor) check and take the higher result (you must announce that you are using this ability before the results of the check are known).<br>You came to a tavern in Port Peril called the Formidably Maid in search of your fate. You’re not sure how many drinks you had, but they quickly went to your head and you passed out on the table before you found your destiny—unless it lay in the bottom of a bottle. Then again, maybe you found your destiny after all...	https://aonprd.com/TraitDisplay.aspx?ItemName=Besmara's%20Blessing
Best Customer	Campaign	Campaign	Varisia, Birthplace of Legends pg. 29		You’ve sat on your favorite barstool at the Rusty Dragon every night for as long as you can remember— and some nights you can’t remember thanks to a few too many drinks. In your various hazes, you’ve gotten to know the tap house’s proprietor, Ameiko, or one of her regulars, Sandru, quite well. Additionally, you’re well acquainted with a variety of uses for strong drink. Any time you have an alcoholic beverage on hand, you can expend one use of it to grant you a +2 trait bonus on a Heal check. This bonus increases to +4 if you’re treating your favorite drinking buddy (your NPC of choice). NPC Choices: Ameiko, Sandru.	https://aonprd.com/TraitDisplay.aspx?ItemName=Best%20Customer
Best Friend	Campaign	Campaign	Jade Regent Player's Guide pg. 12		You are best friends with one of the NPCs; you’ve grown up together, and while your friend has had a much more exciting life than you so far, you hope one day to follow in your friend’s footsteps and see the world—or perhaps even become an adventurer yourself. You’ve picked up a lot from your friend, but particularly his or her skill in interacting with others. If Ameiko is your best friend, you gain a +2 trait bonus on Diplomacy checks. If Sandru is your best friend, you gain a +2 trait bonus on Bluff checks. Whichever skill you gain a trait bonus on, that skill is always considered a class skill for you. In addition, in situations where your best friend is in danger, you gain a +1 trait bonus on all attack rolls against foes that threaten your friend. NPC Choices: Ameiko, Sandru.	https://aonprd.com/TraitDisplay.aspx?ItemName=Best%20Friend
Betrayed	Campaign	Campaign	Curse of the Crimson Throne (PFRPG) pg. 8		You were hardly a model citizen as a child or young adult. Your reasons for turning to a life of crime may be varied, but what matters is that you eventually fell in with a certain well-connected and notorious crime lord named Gaedren Lamm. His reputation as a snake and a treacherous scoundrel was known to you, but for reasons of your own, you chose not to turn him down when he offered you a chance to work for him. You may have assumed you were an exception, or that you’d be able to handle him, or perhaps even planned to betray him. As it worked out, though, Gaedren got the upper hand and took you down you first. You may have served time in jail, may have been beaten by his thugs and left for dead, or could simply have had your profits stolen out from under you. Whatever the cause, Gaedren wronged you, and you are eager for the chance to get revenge.<br>Choose one of the following benefits.<br>Hungry for Revenge: You’ve never forgiven Gaedren for his betrayal, and have vowed to make him pay for what he did. Whether that’s seeing him rot in jail or a shallow grave, you hope to taste vengeance someday. Whenever you deal damage with a melee weapon on a creature that is flat-footed, you gain a +1 trait bonus on the damage roll.<br>Reformed Criminal: You’ve given up the life of crime, and managed to talk your way out of any repercussions such as jail time or fines. You’ve told yourself that you would rather leave your past behind, yet the concept of seeing Gaedren Lamm pay for his crimes still appeals to you. You gain a +1 trait bonus on Diplomacy checks, and Diplomacy is a class skill for you.	https://aonprd.com/TraitDisplay.aspx?ItemName=Betrayed
Black Sheep	Campaign	Campaign	Advanced Player's Guide pg. 330		You were born and raised in town. You know many of the region’s secrets and the locals already know who you are. You aren’t quite hated in town, but folk seem to think you’re a troublemaker and a bastard and not to be trusted. The town’s tougher folk respect you, but the law-abiding citizens don’t. You gain a +1 trait bonus on Knowledge (local) checks, and Knowledge (local) is a class skill for you. In addition, you can choose any one notorious citizen from below as an ally; depending on the person you pick, you’ll get different benefits.<br>Apothecary: Everyone suspects the sweaty, shifty-eyed apothecary sells poisons from his cluttered, acrid smelling wreck of a shop. You’re one of the few in town who know this for a fact. You start the game with 400 gp worth of poison, and the apothecary will continue to sell you poison as long as you don’t spread the word.<br>Bitter Nobleman: A local unscrupulous family was hit hard recently, revealing criminal ties that damaged its reputation as well. One noble is eager to rebuild his presence in town, and you’re one of the ones he’s selected as an agent. Choose one of the following skills: Bluff, Sleight of Hand, or Stealth. Your work for the family gives you a +1 trait bonus on that skill, and it is always a class skill for you.	https://aonprd.com/TraitDisplay.aspx?ItemName=Black%20Sheep
Blight-Burned	Campaign	Campaign	Ironfang Invasion Player's Guide pg. 7		You were raised deep in the Fangwood Forest, but in your childhood the Darkblight overtook your community, and blighted fey attacked your friends and family. Even after escaping, you barely survived infection by the otherworldly fungal disease and still bear a terrible scar from your ordeal. You gain a +2 trait bonus on Fortitude saving throws against disease or poison (your choice), and your scar now throbs painfully in the presence of unnatural creatures, immediately alerting you to their presence. This sixth sense alerts you to the presence of aberrations, oozes, and all creatures with the blighted fey and fungal creature templates within 30 feet (though it doesn’t indicate their exact location). You can always act during the surprise round against such creatures, and you aren’t considered flat-footed against such creatures in the first round of combat.	https://aonprd.com/TraitDisplay.aspx?ItemName=Blight-Burned
Blood of Giants	Campaign	Campaign	Reign of Winter Player's Guide pg. 5		You’re a big person, and people have always said you’ve got some giant blood in you. Even as a child, you towered over your friends, and as you grew older, you grew even taller and stronger. Maybe your hair has a tint of blue as well, or your skin is as pale as snow. Perhaps someday you’ll get the opportunity to travel to the North and meet some real giants, and see whether the rumors about you are true. You gain a +1 trait bonus on combat maneuver checks to sunder, and a +1 trait bonus to your CMD against bull rush and overrun combat maneuvers.	https://aonprd.com/TraitDisplay.aspx?ItemName=Blood%20of%20Giants
Blood of Pharaohs	Campaign	Campaign	Mummy's Mask Player's Guide pg. 9		Long ago, one of your ancestors ruled over the lands of Osirion. Although you are many generations removed and the line of descent is hard to prove, his or her blood still runs in your veins. Perhaps you may find some proof of your lineage in the tombs of Wati’s necropolis. You gain a +1 trait bonus on Will saves. You also gain a +1 trait bonus on Knowledge (nobility) checks and that skill is always a class skill for you. In addition, you may choose Ancient Osiriani as one of your bonus languages.	https://aonprd.com/TraitDisplay.aspx?ItemName=Blood%20of%20Pharaohs
Boarded in Cheliax	Campaign	Campaign	Serpent's Skull Player's Guide pg. 10		While you aren’t necessarily a native of Cheliax, you boarded the Jenivere at one of that country’s port cities. As the people of Cheliax generally know the Mwangi Expanse as a near legendary land home to strange beasts and exotic treasures, your views of the region have a distinctly romantic tinge, and the desire for fame, wealth, and adventure likely motivate your travels. You begin the campaign with a detailed map of the Mwangi Expanse (this grants +2 competence bonus on all Knowledge [geography] checks made regarding this region) and 200 gp worth of mundane equipment to aid your exploration of the jungle.	https://aonprd.com/TraitDisplay.aspx?ItemName=Boarded%20in%20Cheliax
Boarded in Mediogalti	Campaign	Campaign	Serpent's Skull Player's Guide pg. 10		Your travels have brought you to the Jenivere through the dangerous port of Ilizmagorti, home to both pirates and assassins. Perhaps you’re fleeing a price on your head, perhaps you’ve jumped ship from another vessel, or perhaps you’re merely looking for a new start in a land where the dangers make themselves more obvious. Your familiarity with subtle slayings and toxins grants you a +2 trait bonus on all saves against poison. In addition, you can pick one type of poison listed below to be immune to, having undergone a long and painful process of building up an immunity to its effects: blue whinnis, giant wasp poison, medium spider venom, small centipede poison, or spider vine poison (a poison derived from a toxic plant native to the Mwangi Expanse).	https://aonprd.com/TraitDisplay.aspx?ItemName=Boarded%20in%20Mediogalti
Boarded in Mwangi Expanse	Campaign	Campaign	Serpent's Skull Player's Guide pg. 11		You boarded the Jenivere in the Mwangi Expanse, where you’ve lived or recently traveled through. You harbor no illusions regarding the deadliness of the jungles, the creatures that inhabit it, or the peoples that make their home therein. You gain Polyglot as a bonus language and receive a +1 trait bonus on all Knowledge (nature) checks regarding the jungle.	https://aonprd.com/TraitDisplay.aspx?ItemName=Boarded%20in%20Mwangi%20Expanse
Boarded in Varisia	Campaign	Campaign	Serpent's Skull Player's Guide pg. 11		Traveling from lands far to the north, you likely have little experience with the jungle, its denizens, or its strange forces. Just as the lands of Garund are wild and exotic to you, so are you to them. This unusualness manifests in one of two ways. Choose to gain either a +2 trait bonus on all Bluff checks made against inhabitants of the jungle, or treat your spells with the mind-affecting descriptor as being +1 caster level higher when cast against creatures and natives of the jungle.	https://aonprd.com/TraitDisplay.aspx?ItemName=Boarded%20in%20Varisia
Boarded in the Shackles	Campaign	Campaign	Serpent's Skull Player's Guide pg. 11		Your last home was in the Shackles, a dangerous land of pirates and treachery, but also of fantastic opportunity. A life of weal and woe on the sea and amid the pirate controlled lands has toughened you to a variety of hardships. Pick one of the three categories of saving throws—you gain a +1 trait bonus on all saving throws of that type.	https://aonprd.com/TraitDisplay.aspx?ItemName=Boarded%20in%20the%20Shackles
Brigand	Campaign	Campaign	Kingmaker Player's Guide pg. 10		You hail from the River Kingdoms or the more lawless reaches of Brevoy. Life has been hard for you. Perhaps your parents and siblings were crooks and con artists, or maybe your rough, lonely life lead you to fall in with thieves and worse. You know how to ambush travelers, bully traders, avoid the law, and camp where no one might find you. Recently, you’ve run into some trouble, either with the law or with other bandits, and you’re looking to get away to somewhere no one would ever think to look for you. An expedition into the rugged wilderness seems like a perfect way to lie low until the trouble blows over. You begin the campaign with an extra 100 gp in ill-gotten gains. You also gain a +1 trait bonus on Bluff, Diplomacy, Intimidate, and Sense Motive checks when dealing with brigands, thieves, bandits, and their ilk.	https://aonprd.com/TraitDisplay.aspx?ItemName=Brigand
Buccaneer's Blood	Campaign	Campaign	Skull and Shackles Player's Guide pg. 5		One of your ancestors was an infamous Free Captain of the Shackles, whose very name struck fear in the hearts of those who sailed the seas in search of an honest living. Piracy is in your blood, and you’ve always longed to follow in your forebear’s footsteps and plunder the shipping lanes. You gain a +1 trait bonus on Intimidate and Profession (sailor) checks. In addition, you gain a one-time +1 trait bonus to your Disrepute and Infamy scores (see “The Life of a Pirate” in Pathfinder Adventure Path #55 for details on the Infamy system).<br>You went to a tavern called the Formidably Maid, a notorious pirate hangout in Port Peril, eager to start your career as a buccaneer. While you were there, however, a dashing and flirtatious corsair caught your eye, and after a whirlwind night of booze and romance, you found yourself beaten senseless and stuffed in a sack, carried off to who knows where.	https://aonprd.com/TraitDisplay.aspx?ItemName=Buccaneer's%20Blood
Caravan Guard	Campaign	Campaign	Jade Regent Player's Guide pg. 12		You recently hired on to Sandru’s caravan to serve as a guard, but the job, while it paid well, gave you little chance to scratch the adventuring itch, since the caravan never really ventured into dangerous territory. You understand why Sandru avoided the more dangerous routes, of course, but that didn’t help assuage your urge to seek adventure. You’ve just told Sandru that you’re quitting the job in order to try your hand at adventuring— he seemed to understand, and even gave you some good tips on how best to survive potential challenges. You gain a +1 trait bonus on Survival checks, and Survival becomes a class skill for you. NPC Choices: Sandru.	https://aonprd.com/TraitDisplay.aspx?ItemName=Caravan%20Guard
