name	type	category	source	requirements	description	url
Absalom Bouncer	Basic (Combat)	Basic (Combat)	Advanced Class Origins pg. 11		You learned to fight while serving as a bodyguard in the taverns of Absalom, where keeping the patrons alive through bloody bar brawls was just part of your job. When you make an attack that deals nonlethal damage with an unarmed strike, you gain a +1 bonus on your damage roll.	https://aonprd.com/TraitDisplay.aspx?ItemName=Absalom%20Bouncer
Absolute Loyalty	Basic (Combat)	Basic (Combat)	Knights of the Inner Sea pg. 0		You gain the one-time ability to immediately cast atonement upon yourself as a spell-like ability upon performing an act or being subjected to an effect that spell affects. This ability can only be used while you are acting in the service of your liege (an individual of higher social standing chosen when you take this feat).	https://aonprd.com/TraitDisplay.aspx?ItemName=Absolute%20Loyalty
Accelerated Drinker	Basic (Combat)	Basic (Combat)	Cheliax, Empire of Devils pg. 18		You know how to drink a potion efficiently, such as by not using your hands, tossing it in the air and catching it in your mouth, or opening it with your teeth. You may drink a potion as a move action instead of a standard as long as you start your turn with the potion in your hand.	https://aonprd.com/TraitDisplay.aspx?ItemName=Accelerated%20Drinker
Aldori Caution	Basic (Combat)	Basic (Combat)	Weapon Master's Handbook pg. 4		You learned defensive moves from Aldori trainers. You gain an additional +1 dodge bonus to Armor Class while you fight defensively or use the total defense action.	https://aonprd.com/TraitDisplay.aspx?ItemName=Aldori%20Caution
Ambush Training	Basic (Combat)	Basic (Combat)	Pathfinder Society Primer pg. 15		You’ve learned that taking an<br>enemy by surprise can end a combat before it begins.<br>You gain a +1 trait bonus on initiative checks and a +1<br>trait bonus on weapon damage rolls during any surprise<br>round in which you act.	https://aonprd.com/TraitDisplay.aspx?ItemName=Ambush%20Training
Anatomist	Basic (Combat)	Basic (Combat)	Ultimate Campaign pg. 51		You have studied the workings of anatomy,<br>either as a student at university or as an apprentice<br>mortician or necromancer. You know where to aim your<br>blows to strike vital organs. You gain a +1 trait bonus on<br>all rolls made to confirm critical hits.	https://aonprd.com/TraitDisplay.aspx?ItemName=Anatomist
Armed Grit	Basic (Combat)	Basic (Combat)	Weapon Master's Handbook pg. 5		You make an impression during a standoff. As long as you have a firearm drawn, you gain a +2 trait bonus on saving throws against fear and the DCs of Intimidate checks to demoralize you increase by 2.	https://aonprd.com/TraitDisplay.aspx?ItemName=Armed%20Grit
Armor Expert	Basic (Combat)	Basic (Combat)	Ultimate Campaign pg. 51		You have worn armor as long as you<br>can remember, either as part of your training to become<br>a knight’s squire or simply because you were seeking to<br>emulate a hero. Your childhood armor wasn’t the real<br>thing as far as protection, but it did encumber you as<br>much as real armor would have, and you’ve grown used to<br>moving in such suits with relative grace. When you wear<br>armor of any sort, reduce that suit’s armor check penalty<br>by 1, to a minimum check penalty of 0.	https://aonprd.com/TraitDisplay.aspx?ItemName=Armor%20Expert
Armored Rider	Basic (Combat)	Basic (Combat)	Armor Master's Handbook pg. 3		You gain a +1 trait bonus on Ride checks, and Ride is a class skill for you. You don’t take an armor check penalty on Ride checks while wearing light or medium armor.	https://aonprd.com/TraitDisplay.aspx?ItemName=Armored%20Rider
Armored Soul	Basic (Combat)	Basic (Combat)	Armor Master's Handbook pg. 3		When wearing armor or using a shield, you gain a +1 trait bonus on saving throws against divine spells that deal damage.	https://aonprd.com/TraitDisplay.aspx?ItemName=Armored%20Soul
Arodenite Sword Training	Basic (Combat)	Basic (Combat)	Arcane Anthology pg. 10		Your family has passed down training in Aroden’s favored weapon, even though the god no longer answers their prayers. You are proficient with the longsword. If your class grants longsword proficiency as well, you gain a +1 trait bonus on attacks of opportunity with longswords.	https://aonprd.com/TraitDisplay.aspx?ItemName=Arodenite%20Sword%20Training
Axe to Grind	Basic (Combat)	Basic (Combat)	Ultimate Campaign pg. 51		There is a fire in your heart that can’t be<br>quenched. You gain a +1 trait bonus on damage against<br>foes who are threatened by only you.	https://aonprd.com/TraitDisplay.aspx?ItemName=Axe%20to%20Grind
Back for More	Basic (Combat)	Basic (Combat)	Agents of Evil pg. 11		Anytime an opponent confirms a critical hit against you, you gain a +2 morale bonus on attack rolls and damage rolls against that foe until the end of your next turn.	https://aonprd.com/TraitDisplay.aspx?ItemName=Back%20for%20More
Battlefield Disciple	Basic (Combat)	Basic (Combat)	Ultimate Campaign pg. 51		You are skilled at supporting<br>your allies in the heat of battle. You gain a +2 trait bonus<br>on Heal checks made to stabilize a dying creature. In<br>addition, when you successfully use the aid another action<br>in combat to grant an ally a bonus on her next attack roll,<br>the bonus you grant increases by 1.	https://aonprd.com/TraitDisplay.aspx?ItemName=Battlefield%20Disciple
Berserker of the Society	Basic (Combat)	Basic (Combat)	Shattered Star Player's Guide pg. 5	Barbarian, Pathfinder Society	Your time spent as a Pathfinder has taught you new truths about the origins of the your rage ability. You may use your rage ability for 3 additional rounds per day.	https://aonprd.com/TraitDisplay.aspx?ItemName=Berserker%20of%20the%20Society
Black Powder Bravado	Basic (Combat)	Basic (Combat)	Ultimate Campaign pg. 51		You are particularly successful<br>when using deeds. Once per day, when you perform a deed<br>that requires an attack roll and you miss with that roll,<br>you can reroll it. You must take the second result even if<br>it is worse.	https://aonprd.com/TraitDisplay.aspx?ItemName=Black%20Powder%20Bravado
Black Powder Fortune	Basic (Combat)	Basic (Combat)	Ultimate Campaign pg. 51		You have little to fear when<br>there’s a gun in your hand. As long as you are wielding<br>a firearm, you gain a +2 trait bonus on all saving throws<br>against curse, fear, and emotion effects.	https://aonprd.com/TraitDisplay.aspx?ItemName=Black%20Powder%20Fortune
Black Powder Interjection	Basic (Combat)	Basic (Combat)	Ultimate Campaign pg. 51		Your confidence rises when<br>you foil spellcasting. Once per day, when you interrupt the casting of a spell with a firearm attack, you may<br>regain 1 grit point.	https://aonprd.com/TraitDisplay.aspx?ItemName=Black%20Powder%20Interjection
Blackjacket Weapon Flair	Basic (Combat)	Basic (Combat)	Weapon Master's Handbook pg. 4		You trained with the Blackjackets of Druma to make optimal use of magic weapons. Whenever you roll a natural 20 (the die shows a “20”) on a combat maneuver check with a magic weapon, you gain a +5 trait bonus on the check.	https://aonprd.com/TraitDisplay.aspx?ItemName=Blackjacket%20Weapon%20Flair
Blade of the Society	Basic (Combat)	Basic (Combat)	Shattered Star Player's Guide pg. 5	Rogue, Pathfinder Society	The Society gave you access to charts detailing the weak spots of hundreds of humanoids and monsters. You gain a +1 trait bonus on damage rolls from sneak attacks.	https://aonprd.com/TraitDisplay.aspx?ItemName=Blade%20of%20the%20Society
Blight's Bane	Basic (Combat)	Basic (Combat)	People of the Wastes pg. 3		You are trained in the destruction of blights. You gain a +2 trait bonus to confirm critical hits against a creature that has a template affiliated with some kind of communicable condition, such as a blighted fey or a fungal creature.	https://aonprd.com/TraitDisplay.aspx?ItemName=Blight's%20Bane
Bloodthirsty	Basic (Combat)	Basic (Combat)	Ultimate Campaign pg. 52		You have a vicious streak, and nothing<br>satisfies you more than warm blood on your hands and<br>blade. Whenever you make an attack that reduces a foe to<br>0 hit points or fewer or you confirm a critical hit, your<br>attack deals 1 additional point of damage. The additional<br>damage is a trait bonus, and is multiplied by your weapon’s<br>critical hit multiplier.	https://aonprd.com/TraitDisplay.aspx?ItemName=Bloodthirsty
Bloody-Minded	Basic (Combat)	Basic (Combat)	Champions of Corruption pg. 11		You are always ready for bloodshed. You gain a +1 trait bonus on initiative and Intimidate checks.	https://aonprd.com/TraitDisplay.aspx?ItemName=Bloody-Minded
Born under the Cradle	Basic (Combat)	Basic (Combat)	People of the Stars pg. 27		Your birth sign aligned significantly with Bretheda on the day you were born, granting you a knack for cooperation in the heat of battle. You gain a +2 trait bonus on attack rolls to perform the aid another action.	https://aonprd.com/TraitDisplay.aspx?ItemName=Born%20under%20the%20Cradle
Born under the Dreamer	Basic (Combat)	Basic (Combat)	People of the Stars pg. 25		Your birth sign aligned significantly with Liavara on the day you were born, and you are touched by the instinctual dreaming spirit of that planet, making you naturally poised and hard to surprise. Once per day as a free action, you can take 10 on your initiative check.	https://aonprd.com/TraitDisplay.aspx?ItemName=Born%20under%20the%20Dreamer
Born under the Stranger	Basic (Combat)	Basic (Combat)	People of the Stars pg. 31		Your birth was marked by the alignment of Aucturn with your birth sign and by strange happenings, giving you a link to alien beings. When feinting against aberrations, you do not take a –4 penalty for feinting against a non-humanoid creature, and you take only a –4 penalty if you feint against an aberration of animal Intelligence (instead of –8). You still cannot feint against mindless creatures.	https://aonprd.com/TraitDisplay.aspx?ItemName=Born%20under%20the%20Stranger
Broken, Not Beaten	Basic (Combat)	Basic (Combat)	Agents of Evil pg. 11		You automatically stabilize when reduced below 0 hit points. Once per day when brought below 0 hit points, you can accept 1 point of damage to regain consciousness for 1 round, though you remain staggered and only able to take a single move or standard action.	https://aonprd.com/TraitDisplay.aspx?ItemName=Broken,%20Not%20Beaten
Bullied	Basic (Combat)	Basic (Combat)	Ultimate Campaign pg. 52		You were bullied often as a child, and you are<br>now constantly ready to defend yourself with your fists<br>when an enemy comes near. You gain a +1 trait bonus on<br>attack of opportunity attack rolls made with unarmed<br>strikes. Note that this trait does not grant the ability to<br>make attacks of opportunity with your unarmed strikes—<br>you must have a level in monk, the Improved Unarmed<br>Strike feat, or some other similar power to gain the use<br>of this character trait. However, that doesn’t prevent you<br>from selecting this trait. You simply cannot make use of<br>it until a later point if you do.	https://aonprd.com/TraitDisplay.aspx?ItemName=Bullied
Careful Combatant	Basic (Combat)	Basic (Combat)	Champions of Purity pg. 11		You have a strong<br>sense of self-preservation, believing it is more<br>important to safely extract yourself from a fight that has turned hopeless than to stubbornly stand your<br>ground and risk death—for when you’re dead, you can’t<br>protect the innocent. When using the withdraw action,<br>both the first and second squares of your movement are<br>not considered threatened by any opponents you can see,<br>rather than just the first square.	https://aonprd.com/TraitDisplay.aspx?ItemName=Careful%20Combatant
Clockwork Engineer	Basic (Combat)	Basic (Combat)	People of the Wastes pg. 3		You have experience with the ancient clockwork constructs that roam certain wastelands, and this has granted you an understanding of these guardians. You gain a +2 trait bonus on damage rolls against creatures with the clockwork subtype.	https://aonprd.com/TraitDisplay.aspx?ItemName=Clockwork%20Engineer
Coherent Rage	Basic (Combat)	Basic (Combat)	Faction Guide pg. 62	Ulfen Guard	Your determination allows you to hold onto a shred of your rational mind at all times. Select one of the following skills: Bluff, Escape Artist, Handle Animal, or Stealth. You may use this skill normally while raging.	https://aonprd.com/TraitDisplay.aspx?ItemName=Coherent%20Rage
Cold and Calculating	Basic (Combat)	Basic (Combat)	Ultimate Campaign pg. 52		You are adept at tricking favored<br>enemies of your race or those related to your race. You<br>gain a +1 trait bonus on all Bluff checks against favored<br>enemies that share one of your subtypes. You also gain a<br>+1 trait bonus on attack rolls made against such favored<br>enemies during the surprise round.	https://aonprd.com/TraitDisplay.aspx?ItemName=Cold%20and%20Calculating
Courageous	Basic (Combat)	Basic (Combat)	Ultimate Campaign pg. 52		Your childhood was brutal, but you<br>persevered through force of will and faith. No matter<br>how hard things got, you knew you’d make it through as<br>long as you kept a level head. You gain a +2 trait bonus on<br>saving throws against fear effects.	https://aonprd.com/TraitDisplay.aspx?ItemName=Courageous
Crimson Carapace	Basic (Combat)	Basic (Combat)	Armor Master's Handbook pg. 3		A combination of armor and agility protects you from deadly attacks. When wearing light armor and fighting defensively or using Combat Expertise, you receive a +2 trait bonus to your AC against attack rolls to confirm a critical threat.	https://aonprd.com/TraitDisplay.aspx?ItemName=Crimson%20Carapace
Crowd Dodger	Basic (Combat)	Basic (Combat)	Quests and Campaigns pg. 18		You spent much of your youth on<br>crowded streets, dodging quickly around and under<br>others. You gain a +2 trait bonus on Acrobatics checks<br>to move through another creature’s space and to avoid<br>attacks of opportunity for leaving a threatened square.<br>Suggested Characters: Absalom natives, Chelaxians,<br>Lion Blades.	https://aonprd.com/TraitDisplay.aspx?ItemName=Crowd%20Dodger
Dedicated Defender	Basic (Combat)	Basic (Combat)	Ultimate Campaign pg. 52		When a companion is down, you<br>fight harder. You gain a +1 trait bonus on attack rolls<br>and on checks made to overcome spell resistance while<br>you are adjacent to a dying or disabled ally, animal<br>companion, eidolon, familiar, or mount.	https://aonprd.com/TraitDisplay.aspx?ItemName=Dedicated%20Defender
Defender of the Society	Basic (Combat)	Basic (Combat)	Shattered Star Player's Guide pg. 5	Fighter, Pathfinder Society	Your time spent studying the greatest warriors of the Society taught you new defensive skills while wearing armor. You gain a +1 trait bonus to Armor Class when wearing medium or heavy armor.	https://aonprd.com/TraitDisplay.aspx?ItemName=Defender%20of%20the%20Society
Deft Dodger	Basic (Combat)	Basic (Combat)	Ultimate Campaign pg. 52		Growing up in a rough neighborhood<br>or a dangerous environment has honed your senses. You<br>gain a +1 trait bonus on Reflex saves.	https://aonprd.com/TraitDisplay.aspx?ItemName=Deft%20Dodger
Demon Slayer	Basic (Combat)	Basic (Combat)	Faction Guide pg. 62	Mendev Crusaders	By studying a demonic opponent, you can sense and target its weak spots. You can attempt a Knowledge (planes) check to find a demon’s weak spot. (DC 10 + the demon’s CR). If you succeed, you gain a +3 trait bonus on rolls to confirm critical hits against that demon until the end of the battle. This effect only works on demons.	https://aonprd.com/TraitDisplay.aspx?ItemName=Demon%20Slayer
Demon Smiter	Basic (Combat)	Basic (Combat)	Champions of Purity pg. 13		You grew up around those<br>who fight the demons streaming out of the Worldwound,<br>and from their stories you learned about the demons’<br>weaknesses. You are likely from Mendev or have joined that<br>nation’s cause as a crusader. Once per day when fighting<br>demons, you gain a +4 trait bonus on a single attack roll.	https://aonprd.com/TraitDisplay.aspx?ItemName=Demon%20Smiter
Devil Fighter	Basic (Combat)	Basic (Combat)	Armor Master's Handbook pg. 2		Learning how devils think helps you resist their trickery. You gain a +1 trait bonus to your AC against attacks made by lawful outsiders.	https://aonprd.com/TraitDisplay.aspx?ItemName=Devil%20Fighter
Dirty Fighter	Basic (Combat)	Basic (Combat)	Ultimate Campaign pg. 52		You wouldn’t have lived to make it<br>out of childhood without the aid of a sibling, friend,<br>or companion you could always count on to<br>distract your enemies long enough for you<br>to do a little bit more damage than normal.<br>That companion may be another PC or an<br>NPC (who may even be recently departed<br>from your side). When you hit a foe you<br>are flanking, you deal 1 additional point<br>of damage (this damage is added to<br>your base damage, and is multiplied on<br>a critical hit). This additional damage is a<br>trait bonus.	https://aonprd.com/TraitDisplay.aspx?ItemName=Dirty%20Fighter
Dirty Trickster	Basic (Combat)	Basic (Combat)	Antihero's Handbook pg. 7		You learned early that there’s no point in fighting fair when you’re fighting for your life. Others may look down their noses at your tactics, but you know you wouldn’t have survived this long without breaking a few conventions of fair play. You can take the Improved Dirty TrickAPG feat without meeting its prerequisites, and you gain a +1 trait bonus on combat maneuver checks to attempt a dirty trickAPG.	https://aonprd.com/TraitDisplay.aspx?ItemName=Dirty%20Trickster
Disillusioned	Basic (Combat)	Basic (Combat)	Quests and Campaigns pg. 18		Your childhood was ended by a great<br>disaster or atrocity that you witnessed. To cope with<br>the horror, you have learned to reflexively suppress all<br>emotion. You gain a +2 trait bonus on Will saving throws<br>against emotion and fear effects.<br>Suggested Characters: Galtans, Hellknights, Nidalese.	https://aonprd.com/TraitDisplay.aspx?ItemName=Disillusioned
Dispelled Battler	Basic (Combat)	Basic (Combat)	Ultimate Campaign pg. 52		When deprived<br>of magic, you fight harder. You gain<br>a +1 trait bonus on weapon attack<br>and damage rolls while within<br>an area of antimagic such as that<br>created by an antimagic field. You also<br>gain this bonus for 1 round after you are<br>subject to an area or targeted dispel magic<br>spell, regardless of the effect’s success<br>or failure in dispelling your spells<br>and magical effects.	https://aonprd.com/TraitDisplay.aspx?ItemName=Dispelled%20Battler
Dormant Defense	Basic (Combat)	Basic (Combat)	People of the Wastes pg. 4		Your body never lets down its defenses, even when you rest. The DC for Perception checks you attempt while asleep increases only by 7 (instead of the normal +10 increase). While you are dazed, stunned, or helpless, each critical hit or sneak attack scored against you has a 25% chance of being negated; when a critical hit or sneak attack is negated, roll its damage normally. This doesn’t stack with the fortification armor special ability and similar effects.	https://aonprd.com/TraitDisplay.aspx?ItemName=Dormant%20Defense
Dragon Armor	Basic (Combat)	Basic (Combat)	Armor Master's Handbook pg. 3		Xa Hoi’s elite warriors are trained to deflect energy attacks. Choose an energy type (acid, cold, electricity, fire, or sonic) when you acquire this trait. When you are wearing medium or heavy armor, you gain a +2 trait bonus on Reflex saves against spells and effects of the chosen energy type.	https://aonprd.com/TraitDisplay.aspx?ItemName=Dragon%20Armor
Dueling Cloak Adept	Basic (Combat)	Basic (Combat)	Knights of the Inner Sea pg. 0		You are trained in using your cloak to disguise your body and deceive your enemies. While wearing a cloak and using an Aldori dueling sword, you gain a +2 trait bonus on Bluff checks made to feint. Additionally, every time you successfully feint while wearing a cloak, you gain a +1 dodge bonus to your Armor Class until your next turn.	https://aonprd.com/TraitDisplay.aspx?ItemName=Dueling%20Cloak%20Adept
Easy Way or the Hard Way	Basic (Combat)	Basic (Combat)	Ultimate Campaign pg. 52		You are skilled at subduing<br>your enemies. Whenever you<br>attack one of your favored<br>enemies with a weapon that<br>deals lethal damage and<br>choose to deal nonlethal<br>damage, you take only<br>a –2 penalty on the<br>attack roll instead of the<br>normal –4.	https://aonprd.com/TraitDisplay.aspx?ItemName=Easy%20Way%20or%20the%20Hard%20Way
Elemental Apprentice	Basic (Combat)	Basic (Combat)	Elemental Master's Handbook pg. 3		You spent your childhood in a region of Golarion where the use of elemental magic is commonplace or the environment is heavily infused with elemental energies, such as the volcano Asuulek’s Mouth or the hurricane-lashed Sodden Lands. Your time near raw elemental energies has inured you to taking damage from them. At character creation, select acid, cold, electricity, or fire (once chosen, this damage type can’t be changed). Once per day as a free action, when you hit a creature with a melee weapon, you can convert an amount of damage dealt by your attack equal to your character level into the selected energy type. You cannot convert this damage if any damage from the attack would normally deal a different type of energy damage (such as that of a flaming weapon).	https://aonprd.com/TraitDisplay.aspx?ItemName=Elemental%20Apprentice
Evasive Sting	Basic (Combat)	Basic (Combat)	Ultimate Campaign pg. 53		Larger enemies have a hard time striking<br>you. You gain a +1 dodge bonus to AC against enemies<br>that are both your favored enemy and at least two size<br>categories larger than you.	https://aonprd.com/TraitDisplay.aspx?ItemName=Evasive%20Sting
Excitable	Basic (Combat)	Basic (Combat)	Gnomes of Golarion pg. 14	Gnome	You demand that everything must happen right now, no matter what, and are too impatient to wait for everyone else to catch up. You finish people’s sentences, blurt out the punch lines to slowly-told jokes, rarely make plans, and leap headlong into anything that looks like it might get interesting. While this has sometimes gotten you in trouble, it’s also trained you to start moving a split second before everyone else, and that’s saved your hide a few times as well. You gain a +2 trait bonus on all Initiative checks.	https://aonprd.com/TraitDisplay.aspx?ItemName=Excitable
Failed Aspirant	Basic (Combat)	Basic (Combat)	Advanced Class Origins pg. 11		You’ve failed the trials to gain entry to one of the Houses of Perfection. Though you are disappointed, you were able to pick up one trick from the monks. Choose a single combat maneuver. Once per day, you can perform that combat maneuver without provoking an attack of opportunity, and you gain a +2 bonus on that attempt.	https://aonprd.com/TraitDisplay.aspx?ItemName=Failed%20Aspirant
Faith's Hunter	Basic (Combat)	Basic (Combat)	Ultimate Campaign pg. 53		Divine powers smile upon you each<br>time you grievously wound a favored enemy. When you<br>confirm a critical hit against a favored enemy, you may<br>extend the duration of any divine spell affecting you by<br>1 round. The benefits from multiple critical hits stack.<br>Divine spells with an instantaneous duration can’t be<br>extended in this manner.	https://aonprd.com/TraitDisplay.aspx?ItemName=Faith's%20Hunter
Fencer	Basic (Combat)	Basic (Combat)	Ultimate Campaign pg. 53		You trained with blades for long hours as a<br>youth, either taking lessons in the genteel art of fencing<br>from tutors paid for by your parents or being taken under<br>the wing of a disenfranchised fencer who may have turned<br>to a life of crime. You gain a +1 trait bonus on attack of<br>opportunity attack rolls made with daggers, swords, and<br>similar bladed weapons.	https://aonprd.com/TraitDisplay.aspx?ItemName=Fencer
Firebug	Basic (Combat)	Basic (Combat)	Quests and Campaigns pg. 18		You were the child of a gunsmith or alchemist<br>and always enjoyed experimenting with fiery alchemical<br>items and minor explosives. You gain a +1 trait bonus<br>on attack rolls made with thrown splash weapons and<br>alchemist bombs.<br>Suggested Characters: Alkenstar natives, Katapeshi, Thuvians.	https://aonprd.com/TraitDisplay.aspx?ItemName=Firebug
Fugitive	Basic (Combat)	Basic (Combat)	Antihero's Handbook pg. 7		You crossed the law (or those in charge thought you did), and you are now a wanted criminal. As such, you have grown used to looking over your shoulder wherever you go. While in settlements, you gain a +3 trait bonus on Perception checks to determine awareness for the purpose of a surprise round.	https://aonprd.com/TraitDisplay.aspx?ItemName=Fugitive
Guerrilla Tactics	Basic (Combat)	Basic (Combat)	Wilderness Origins pg. 2		You gain a +2 trait bonus on Stealth checks and Initiative checks in forests.	https://aonprd.com/TraitDisplay.aspx?ItemName=Guerrilla%20Tactics
Hard to Kill	Basic (Combat)	Basic (Combat)	Champions of Purity pg. 7		Your strong will to live and<br>spread good combined with your pure physicality makes<br>you a tough opponent to take down. You may have<br>discovered this as a child after a tragic accident or during<br>the course of your first battle. When you are attempting<br>a Constitution check to stabilize when dying, the penalty<br>on the check is only half your negative hit point total<br>instead of your full negative hit point total.	https://aonprd.com/TraitDisplay.aspx?ItemName=Hard%20to%20Kill
Hellknight Devotion	Basic (Combat)	Basic (Combat)	Advanced Class Origins pg. 25		Your family has strong ties to a Hellknight order, and you harness this belief as a weapon. Once per day as a swift action, you can empower the next single melee attack you make to be treated as lawful-aligned for the purpose of overcoming damage reduction.	https://aonprd.com/TraitDisplay.aspx?ItemName=Hellknight%20Devotion
