name	type	category	source	requirements	description	url
Bellis Axe Master	Region	Region	Andoran, Spirit of Liberty pg. 18	Bellis [in Andoran]	No one knows how to swing an axe better than a Bellisian! You gain a +2 trait bonus on all rolls made to confirm critical hits with axes (battle axe, hand axe, or greataxe).	https://aonprd.com/TraitDisplay.aspx?ItemName=Bellis%20Axe%20Master
Bellis Honey Harvester	Region	Region	Andoran, Spirit of Liberty pg. 18	Bellis [in Andoran]	Your frequent exposure to bees—and their stings—makes all such creatures seem more like nuisances than actual threats. You gain DR 3/— against damage dealt by swarms and a +1 trait bonus on saving throws against distraction and poison from swarms.	https://aonprd.com/TraitDisplay.aspx?ItemName=Bellis%20Honey%20Harvester
Bellis Log Roller	Region	Region	Andoran, Spirit of Liberty pg. 18	Bellis [in Andoran]	The time you spent leaping between slippery logs as they whirled down the Sellen River taught you how to keep your footing. You gain a +1 trait bonus on Acrobatics checks and a +1 trait bonus to your CMB when attempting to resist trip attacks.	https://aonprd.com/TraitDisplay.aspx?ItemName=Bellis%20Log%20Roller
Betrayed Ex-Noble	Region	Region	Blood of the Elements pg. 27	City of Brass	You were born a noble in the City of Brass, but were unjustly stripped of your title or exiled. Now, your ire prevents you from brooking any further insult unto your already disgraced name. Whenever an enemy attempts to feint against you in combat, the DC to do so is equal to 10 + your base attack bonus + your Wisdom modifier, or 10 + your Intimidate bonus, whichever is higher.	https://aonprd.com/TraitDisplay.aspx?ItemName=Betrayed%20Ex-Noble
Big Game Hunter	Region	Region	People of the North pg. 23	Realm of the Mammoth Lords	You have spent long hours hunting giant creatures and have become skilled at bringing them down quickly. You gain a +1 trait bonus on weapon damage rolls against Large or larger creatures of the animal type.	https://aonprd.com/TraitDisplay.aspx?ItemName=Big%20Game%20Hunter
Black Eagle Recruit	Region	Region	People of the River pg. 11	Lambreth	You were recruited to serve as one of Lord Arnefax’s feared Black Eagles for a time, but you have since left that life. You gain a +1 trait bonus on saves against fear effects; this bonus increases to +3 if an evil outsider caused the effect.	https://aonprd.com/TraitDisplay.aspx?ItemName=Black%20Eagle%20Recruit
Blackthorn Rancher	Region	Region	People of the River pg. 11	Lambreth	Domestic animals from Lambreth are known for their resiliency. You gain a +1 trait bonus on Handle Animal checks and Handle Animal is a class skill for you. Your animal companion or bonded mount gains a permanent +3 trait bonus to its maximum hit point total.	https://aonprd.com/TraitDisplay.aspx?ItemName=Blackthorn%20Rancher
Blessed of the Norns	Region	Region	Blood of the Coven pg. 3	Lands of the Linnorm Kings	You or one of your parents belonged to a coven that honored the norns—powerful fey seers—and you still bear their favor in the form of a subtle sense for danger. You gain a +2 trait bonus on Perception checks to notice traps and ambushes, and a +1 trait bonus to your AC against traps and during any surprise round in which you are caught unaware.	https://aonprd.com/TraitDisplay.aspx?ItemName=Blessed%20of%20the%20Norns
Blighted Physiology	Region	Region	People of the River pg. 7	Numeria	Exposure to the corruption that seeps through every drop of water and grain of dirt in Numeria has altered your body. Horrific growths beneath your skin provide you a +1 natural armor bonus to AC, but your body does not work as a normal creature’s would. You become sickened for 1 round anytime you receive magical healing.	https://aonprd.com/TraitDisplay.aspx?ItemName=Blighted%20Physiology
Blood Potion Brewer	Region	Region	Potions and Poisons pg. 2	Belkzen	The orcs of Belkzen routinely mix the blood of their enemies with potions they brew to gain some of their foe’s strength. Twice per day when you brew a potion, you can add some of an enemy’s blood to the mixture. When you do, the potion’s caster level is treated as 1 higher when you drink it for the purpose of determining the duration of the potion’s effects. This ability has no effect if another creature drinks the potion. This trait does not grant the ability to brew potions.	https://aonprd.com/TraitDisplay.aspx?ItemName=Blood%20Potion%20Brewer
Blooded	Region	Region	Dwarves of Golarion pg. 11	Mindspin Mountains	Desperate battles have honed your fighting skills against the ancient enemies of the dwarves. You receive a +1 trait bonus on weapon damage rolls against giants, goblins, and orcs.	https://aonprd.com/TraitDisplay.aspx?ItemName=Blooded
Border Guard	Region	Region	Dragon Empires Primer pg. 13	Kwanlai	You are one of the warriors on the front lines between Kwanlai and Wanshou, and excel at combat against water-dwelling foes. You gain a +2 trait bonus on rolls to confirm critical hits against foes with the aquatic subtype.	https://aonprd.com/TraitDisplay.aspx?ItemName=Border%20Guard
Born under the Green Star	Region	Region	People of the Stars pg. 9	Castrovel	You were born on Castrovel and touched by the planet’s profound psychic bounty. Treat your caster level as 1 higher when casting spells and spell-like abilities with the mind-affecting descriptor.	https://aonprd.com/TraitDisplay.aspx?ItemName=Born%20under%20the%20Green%20Star
Bounty Hunter	Region	Region	Inner Sea Primer pg. 9	Isger	You have made it your mission to help bring the bandits of Isger to justice. You gain a +1 trait bonus on Survival checks to find or follow tracks, and a +1 trait bonus on Perception checks to avoid being surprised.	https://aonprd.com/TraitDisplay.aspx?ItemName=Bounty%20Hunter
Brave Words	Region	Region	Blood of the Ancients pg. 25	Ninshaburian	You inherit your forebears’ ability to fight off terror with bragging or insults. As a swift action, when you have the frightened condition, you can function as if you only have the shaken condition for 1 round by shouting at the source of your fear. You must be able to see the source of the fear condition. You can use this trait only once per fear effect. This trait grants no benefits against the shaken or panicked conditions.	https://aonprd.com/TraitDisplay.aspx?ItemName=Brave%20Words
Brevoy Bandit	Region	Region	People of the River pg. 12	Mivon	You fled the persecution of Brevoy authorities and wound up in Mivon. Whether or not you are guilty of your alleged crimes, you seek to build a new life amid new neighbors. Choose one Profession skill and one ability score other than Wisdom. You add that ability score’s modifier in addition to your Wisdom modifier on checks with the chosen Profession skill.	https://aonprd.com/TraitDisplay.aspx?ItemName=Brevoy%20Bandit
Briar Bandit	Region	Region	Kobolds of Golarion pg. 9	Forest	The time you've spent crawling through thorny brambles and other thick underbrush during raids and ambushes taught you how to move without disturbing the dense flora around you. When in overgrown areas, you gain a +2 trait bonus on Stealth checks and a +1 trait bonus on damage rolls with sneak attacks.	https://aonprd.com/TraitDisplay.aspx?ItemName=Briar%20Bandit
Call of the Longships	Region	Region	People of the North pg. 21	Lands of the Linnorm Kings	Your blood sings with longing to relive the adventures of one of your ancestors, and you are inexorably drawn to the sea. You gain a +1 trait bonus on Profession (sailor) checks and a +1 trait bonus on attack rolls made onboard ships.	https://aonprd.com/TraitDisplay.aspx?ItemName=Call%20of%20the%20Longships
Candidate for Perfection	Region	Region	Inner Sea Primer pg. 9	Jalmeray	You have begun training to enter one of the Houses of Perfection, and have honed your body, mind, and spirit into one well-trained weapon. You gain a +1 trait bonus on attack of opportunity attack rolls made with unarmed strikes.	https://aonprd.com/TraitDisplay.aspx?ItemName=Candidate%20for%20Perfection
Caravan Nomad	Region	Region	Blood of the Beast pg. 2	Kitsune native to Varisia	Your family has lived on the open roads of Varisia for untold generations, impersonating nomadic Varisians. You gain a +1 trait bonus on Bluff and Perform checks, and one of these skills is a class skill for you.	https://aonprd.com/TraitDisplay.aspx?ItemName=Caravan%20Nomad
Carpenden Lobber	Region	Region	Andoran, Spirit of Liberty pg. 19	Carpenden [in Andoran]	Your regular participation in the moonmelon festival has made you wickedly effective at hurling harmless objects. You gain a +2 trait bonus on attack rolls when throwing items that do not deal normal hit point damage (such as weapons that deal nonlethal damage or items such as tanglefoot bags and thunderstones).	https://aonprd.com/TraitDisplay.aspx?ItemName=Carpenden%20Lobber
Carpenden Roof Runner	Region	Region	Andoran, Spirit of Liberty pg. 19	Carpenden [in Andoran]	Your childhood playing atop Carpenden’s buildings has given you a remarkable head for heights. You gain a +2 trait bonus on Acrobatics checks made when you are at least 20 feet above the ground.	https://aonprd.com/TraitDisplay.aspx?ItemName=Carpenden%20Roof%20Runner
Cavern Survivor	Region	Region	Heroes of the Darklands pg. 7	Nar-Voth	You’ve regularly traversed Nar-Voth and know how to subsist in that lightless realm better than most surface dwellers. You gain a +2 trait bonus on Survival checks to survive in a subterranean wilderness, and Survival is a class skill for you.	https://aonprd.com/TraitDisplay.aspx?ItemName=Cavern%20Survivor
Centaur Vengeance	Region	Region	Dragonslayer's Handbook pg. 13	Iobaria	Your nomadic tribe<br>wanders the Ice Steppes of Iobaria. They live in constant<br>fear of the great white wyrm Sjohvornor and feel helpless<br>to stop the dragon’s aggression. Your tribe is filled with<br>wise sages and great warriors, and they resent being<br>cowed by any foe. You vowed that one day you would not<br>have to be afraid of Sjohvornor or any other wyrm. You<br>gain a +2 bonus on saving throws against any dragon’s<br>frightful presence.	https://aonprd.com/TraitDisplay.aspx?ItemName=Centaur%20Vengeance
Chainbreaker	Region	Region	Pirates of the Inner Sea pg. 5	Andoran	You’re an expert at rescuing slaves. You know that a few slaves freed from their chains can help turn the tide during a boarding action. You gain a +1 trait bonus on Disable Device checks made to open locks, Strength checks made to break chains or bars in order to free slaves, and combat maneuver checks made to sunder chains or bars in order to free slaves.	https://aonprd.com/TraitDisplay.aspx?ItemName=Chainbreaker
Channel the Earth	Region	Region	Blood of the Elements pg. 21	Plane of Earth	Perhaps you worship the Elemental Lord of Earth, or perhaps you have gleaned your fated powers via some other means of interacting with the Eternal Delve. Your divine powers are infused with the elemental powers of the Plane of Earth. Whenever you channel positive energy to heal living creatures, affected targets gain a +2 profane bonus to CMD to resist bull rush, reposition, and trip combat maneuvers. Alternately, if you channel negative energy to harm living creatures, affected targets take a –2 penalty to CMD against such combat maneuvers. This effect lasts 1 round.	https://aonprd.com/TraitDisplay.aspx?ItemName=Channel%20the%20Earth
Charau-Ka Slayer	Region	Region	Demon Hunter's Handbook pg. 13	Mwangi Expanse	As a native of the Mwangi Jungle, you’ve had frequent encounters with the charau-ka and learned how to fight against these coldly calculating demon worshipers. You gain a +1 trait bonus to AC against attacks made with thrown weapons.	https://aonprd.com/TraitDisplay.aspx?ItemName=Charau-Ka%20Slayer
Charmed Innocent	Region	Region	Heroes of the Streets pg. 5	Any City	Your apparent good nature or playful charm makes nonevil creatures want to like you. Once per day, before you roll any Charisma check or Charisma-based skill check against a nonevil creature, you can roll twice and take the better result.	https://aonprd.com/TraitDisplay.aspx?ItemName=Charmed%20Innocent
Cheap to Feed	Region	Region	Halflings of Golarion pg. 30	[Halfling] Osirion, Varisian	Life in a big city taught the consequences of pride. Now you have no qualms about pointing out how little of a burden your upkeep would prove to potential employers, captors, innkeepers, or anyone else able to provide you with the necessities of life. You gain a +3 trait bonus on Bluff checks made in order to gain food, water, or shelter.	https://aonprd.com/TraitDisplay.aspx?ItemName=Cheap%20to%20Feed
Chelish Guerrilla	Region	Region	Monster Summoner's Handbook pg. 11	Cheliax	In overthrowing House Thrune, you’ve spent many years training to face the diabolist nobles and the devils they bind. You gain a +2 trait bonus on Knowledge checks to identify devils (and their special powers and weaknesses) and a +1 trait bonus on weapon damage rolls against devils.	https://aonprd.com/TraitDisplay.aspx?ItemName=Chelish%20Guerrilla
Child of Mumia	Region	Region	People of the Sands pg. 19	Osirion	During your childhood, you knew someone who was addicted to mumia, a drug made from the flesh of the dead, whether that was a drug-addled parent, an unsavory employer, or a libertine childhood friend. Although you did not indulge in the ghoulish narcotic yourself, your exposure to it grants you a +1 trait bonus on saving throws against curses and diseases, including magical diseases. (For more information on mumia, see page 21 of Pathfinder Campaign Setting: Lost Kingdoms.)	https://aonprd.com/TraitDisplay.aspx?ItemName=Child%20of%20Mumia
Child of Wati	Region	Region	Undead Slayer's Handbook pg. 15	Osirion	You were raised near the infamous necropolis of Wati, and even managed to sneak into these hallowed grounds on occasion. Entering the clergy of the Voices of the Spire in Wati was a natural choice as you grew older, and your past experiences made you a particularly well-informed disciple of the church. Your effective cleric level is 1 higher for the purposes of channeling positive energy to damage undead. Your effective cleric level cannot exceed your character level.	https://aonprd.com/TraitDisplay.aspx?ItemName=Child%20of%20Wati
Child of the Crusades	Region	Region	Inner Sea Primer pg. 13	Mendev	Your parents stood strong against the demons of the Worldwound, facing down the worst of this world and the Great Beyond. You have inherited their indomitable spirit, and you gain a +2 trait bonus on all saves against fear.	https://aonprd.com/TraitDisplay.aspx?ItemName=Child%20of%20the%20Crusades
Chillblight Emissary	Region	Region	People of the North pg. 19	Irrisen	You have spent considerable time at Chillblight, but have escaped this unearthly fey outpost. You gain DR 1/cold iron but become sickened for 1 round if damaged by a cold iron weapon.	https://aonprd.com/TraitDisplay.aspx?ItemName=Chillblight%20Emissary
Chilled by Brutality	Region	Region	Giant Hunter's Handbook pg. 13	Tundra—Cloud, Frost, River, Rune, Taiga	You were part of a group that was mercilessly attacked by giants of the tundra, who may have gone so far as to eat the dead and dying. After that, little can faze you, but you strongly prefer to finish fights with giants quickly to prevent anything like that from happening again. You gain a +2 trait bonus on attack rolls to confirm critical hits against giants and on saving throws against fear effects.<br>Likely Regions: Brevoy, Irrisen, Lands of the Linnorm Kings, Mendev, Realm of the Mammoth Lords.	https://aonprd.com/TraitDisplay.aspx?ItemName=Chilled%20by%20Brutality
Chivalrous	Region	Region	Inner Sea Primer pg. 21	Taldor	You were raised on tales of heroic knights and benevolent wizards from Taldor’s Golden Age, and try to emulate their great deeds. You gain a +1 trait bonus on Diplomacy and Knowledge (history) checks.	https://aonprd.com/TraitDisplay.aspx?ItemName=Chivalrous
Chosen Child	Region	Region	Dragon Empires Primer pg. 16	Po Li	The oracles of Po Li smiled upon you when your parents claimed you were of divine right, and you were raised with privileges few Po Lians can fathom. Your starting money increases by 900 gp.	https://aonprd.com/TraitDisplay.aspx?ItemName=Chosen%20Child
Citizen of Eleder	Region	Region	Sargava, the Lost Colony pg. 23	Eleder	You live and work in Eleder. You gain a +1 trait bonus on all Knowledge (local) and Knowledge (nobility) checks regarding Eleder.	https://aonprd.com/TraitDisplay.aspx?ItemName=Citizen%20of%20Eleder
Citizen of Kalabuto	Region	Region	Sargava, the Lost Colony pg. 23	Kalabuto	You live and work in Kalabuto. You gain a +1 trait bonus on all Knowledge (local) and Knowledge (history) checks regarding Kalabuto.	https://aonprd.com/TraitDisplay.aspx?ItemName=Citizen%20of%20Kalabuto
Clan Artisan	Region	Region	Dragon Empires Primer pg. 20	Xa Hoi	You were raised in one of the numerous clans of Xa Hoi, and learned a valuable trade in your early years. Pick one Craft skill. You gain a +2 trait bonus on checks with that skill, and it becomes a class skill for you.	https://aonprd.com/TraitDisplay.aspx?ItemName=Clan%20Artisan
Cliff Jumper	Region	Region	Cheliax, Empire of Devils pg. 19	Cliffs of Fury	You spent your early years exploring and foraging along the coastal cliffs. You gain a +1 trait bonus on Acrobatics and Climb checks, and on Reflex saves to avoid falling.	https://aonprd.com/TraitDisplay.aspx?ItemName=Cliff%20Jumper
Cliff Strider	Region	Region	Heroes from the Fringe pg. 3	Arcadia native	You grew up along the Grinding Coast of Arcadia, scaling perilous cliffs and dealing with the dangerous creatures that live on these rocky surfaces. As a move action while climbing, you can climb 5 feet without provoking an attack of opportunity, even if you don’t have a climb speed.	https://aonprd.com/TraitDisplay.aspx?ItemName=Cliff%20Strider
Cliff-Master	Region	Region	Goblins of Golarion pg. 16	Goblin, Varisia	You are adept at scavenging along the cliffs by the sea, and have become a skilled climber. You gain a +1 trait bonus on all Climb and Survival checks.	https://aonprd.com/TraitDisplay.aspx?ItemName=Cliff-Master
Cloistered Upbringing	Region	Region	Heroes of the Streets pg. 5	Any City	Growing up among acolytes or monks, you were exposed to their supernatural power. You gain a +1 trait bonus on saving throws against the supernatural effects of channeled energy or abilities powered by ki, and regain 1 additional hit point when healed by supernatural effects.	https://aonprd.com/TraitDisplay.aspx?ItemName=Cloistered%20Upbringing
Clumsy Slave	Region	Region	Halflings of Golarion pg. 31	[Halfling] Cheliax, Katapesh	As a former slave, you learned how to conceal your malice toward your owner behind a facade of clumsiness. The first time you attack someone with an attack that deals nonlethal damage, your target must make a Sense Motive opposed by your Bluff check minus the damage dealt to realize you actually intended to harm him; failure means he believe the injury was an accident on your part instead (though he may still want to punish you for it).	https://aonprd.com/TraitDisplay.aspx?ItemName=Clumsy%20Slave
Coin Hoarder	Region	Region	Dwarves of Golarion pg. 11	Mindspin Mountains	Everything has a price—and it’s your job to know it. Your starting cash increases to 500 gp.	https://aonprd.com/TraitDisplay.aspx?ItemName=Coin%20Hoarder
Coincunning	Region	Region	Varisia, Birthplace of Legends pg. 24	Varisia—Janderhoff	Whether from working with dwarven merchants or being one yourself, you’ve developed a distinctly dwarven business sense. You receive a +2 trait bonus on Perception checks to notice coins, gems, jewelry, and valuable trade goods. You gain a chance to notice such goods whenever you pass within 10 feet of them, whether or not you are actively looking.	https://aonprd.com/TraitDisplay.aspx?ItemName=Coincunning
Cold Heart	Region	Region	Knights of the Inner Sea pg. 9	Hellknight	You gain a +2 trait bonus on saving throws against spells and effects with the emotion descriptor.	https://aonprd.com/TraitDisplay.aspx?ItemName=Cold%20Heart
Commercial Savvy	Region	Region	Champions of Balance pg. 12	Katapesh	You excel at maximizing mercantile contacts and convincing merchants to dig just a bit deeper into their pockets for you. Whenever you buy from or sell to a merchant, you treat a settlement’s Base Value and Purchase Limit (Pathfinder RPG GameMastery Guide 204) as 10% higher.	https://aonprd.com/TraitDisplay.aspx?ItemName=Commercial%20Savvy
Community-Minded	Region	Region	People of the Sands pg. 21	Rahadoum	While some pray to the gods for mercy or prosperity, you follow a different tack—you believe in improving the lives of those around you through earnest labor and the efforts of you and your community. Your hard-earned discipline and the candor of your words affect all who bear witness. Any morale bonuses you confer upon your allies through your own abilities or spells last 2 additional rounds.	https://aonprd.com/TraitDisplay.aspx?ItemName=Community-Minded
Confidante to the Oppressed	Region	Region	Knights of the Inner Sea pg. 6	Eagle Knight	Others recognize that you are filled with the Andoren spirit of liberty and equality. You gain a +2 trait bonus on Diplomacy checks to improve the attitude of oppressed, enslaved, or imprisoned subjects, and unless they have reason to distrust you, their starting attitude toward you is at least indifferent, if not better.	https://aonprd.com/TraitDisplay.aspx?ItemName=Confidante%20to%20the%20Oppressed
Conscientious Miner	Region	Region	Dragon Empires Primer pg. 12	Jinin	You were one of the mithral miners of Jinin, and learned how to extract the delicate ore as well as determine its value. You gain a +1 trait bonus on Appraise checks, and a +1 trait bonus on Profession (miner) checks. In addition, Profession (miner) becomes a class skill for you.	https://aonprd.com/TraitDisplay.aspx?ItemName=Conscientious%20Miner
Corpse Dodger	Region	Region	Undead Slayer's Handbook pg. 15	Ustalav	You spent your formative years in the town of Ravengro, where your proximity to both a prominent graveyard and an infamous prison left you no stranger to the occasional zombie or skeleton. As such, you developed unique methods of dodging these pests. Once per day, you can cast hide from undead as a spell-like ability. The casting time is a swift action and the caster level for this effect is always 1st; this ability is otherwise identical to the spell.	https://aonprd.com/TraitDisplay.aspx?ItemName=Corpse%20Dodger
Cosmopolitan	Region	Region	Dragon Empires Primer pg. 11	Goka	Your exposure to the many peoples intersecting in Goka and the tongues spoken there has given you a particular facility for speech. You gain a +1 trait bonus on Linguistics checks, and Linguistics becomes a class skill for you.	https://aonprd.com/TraitDisplay.aspx?ItemName=Cosmopolitan
Cruel Master	Region	Region	Pirates of the Inner Sea pg. 9	Okeno	You’re a master of dominating slaves through body language and inflection, and this ability carries over into other lines of work as well. You gain a +1 trait bonus on Intimidate checks, and it becomes a class skill for you.	https://aonprd.com/TraitDisplay.aspx?ItemName=Cruel%20Master
Crusader Road Acolyte	Region	Region	People of the River pg. 9	Thornkeep or Echo Wood	You trained with the Hellknights at Fort Inevitable or the paladins of Iomedae at Fort Riverwatch. If you trained with the Hellknights, you gain a +1 trait bonus on saving throws against chaotic spells and the spell-like abilities of chaotic outsiders. If you trained with the Iomedaean Paladins, you gain this bonus against evil spells and evil outsiders instead.	https://aonprd.com/TraitDisplay.aspx?ItemName=Crusader%20Road%20Acolyte
Crusader Tactician	Region	Region	Inner Sea Primer pg. 11	Lastwall	You have studied at Vigil’s Crusader War College, and are skilled in both heraldry and siege tactics. You gain a +1 trait bonus on Knowledge (engineering) and Knowledge (nobility) checks, and one of these skills is always a class skill for you.	https://aonprd.com/TraitDisplay.aspx?ItemName=Crusader%20Tactician
Cultist Lineage	Region	Region	Advanced Class Origins pg. 21	Mediogalti Island	Your parents were both Red Mantis assassins and your family has a long tradition of service in the Red Mantis cult. Your strict, fanatical upbringing and familiarity with murder have bestowed upon you an air of confidence and menace. This grants you a +1 trait bonus on Intimidate checks. If you act during the surprise round, as a free action during that round you can draw a light weapon (or two if you have the Two-Weapon Fighting feat) .	https://aonprd.com/TraitDisplay.aspx?ItemName=Cultist%20Lineage
Cultivated	Region	Region	Heroes of the Streets pg. 5	Any City	You grew up speaking multiple languages. You learn one additional language. Additionally, when attempting a Diplomacy check to gather information using this language, you can do so in 1d6 × 10 minutes, rather than the normal 1d4 hours.	https://aonprd.com/TraitDisplay.aspx?ItemName=Cultivated
Cunning Liar	Region	Region	Heroes of the Streets pg. 5	Any City	You were forced into hiding or willingly went on the run at a young age, and learned to reading others’ interests to inform your lies. You can use your Intelligence or Wisdom modifier in place of your Charisma modifier on Bluff checks.	https://aonprd.com/TraitDisplay.aspx?ItemName=Cunning%20Liar
Curse Queller	Region	Region	Healer's Handbook pg. 3	Osirion	Whenever a caster level check is required to treat an affliction with magic (such as when casting remove curse on a cursed creature or object), you gain a +2 trait bonus on your caster level check. Additionally, you gain a +1 trait bonus on your saving throws against curses.	https://aonprd.com/TraitDisplay.aspx?ItemName=Curse%20Queller
